"Item No","Item Description","Brand","Qty","Order Multiple","Retail Price","Wholesale Price","Life Cycle Status","Substituted Item"
"6410816","CHUCKIT DG AMPHBS MEGA BAL 1EA","CHUCKIT","0","1","13.99","8.53","LST",""
"6411355","WER CT WX CHK PUREE 3OZ","WERUVA","0","12","2.99","1.8042","LST",""
"6411358","WER CT WX CHK GRAVY 3OZ","WERUVA","12","12","2.99","1.8042","LST",""
"6411359","WER CT WX CK&TLP GRAVY 3OZ","WERUVA","0","12","2.99","1.8042","LST",""
"6445979","PTRGS ROUND SCRTCH 1EA","PETRAGEOUS","0","1","33.99","17.15","LST",""
"6445980","PTRGS EARLY BIRD SCRTCH 1EA","PETRAGEOUS","1","1","30.99","15.59","LST",""
"6445981","PTRGS YELLOW DOTS SCRTCH 1EA","PETRAGEOUS","0","1","44.99","23.39","LST",""
"6410524","JMP DG FLYNG RHINO W SQKR 1EA","JUMP","0","1","22.99","10.39","ROS",""
"6410599","JMP DG TUFF RHINO 1EA","JUMP","0","1","22.99","11.33","LST",""
"6410601","JMP DG TUFF PIG 1EA","JUMP","1","1","22.99","11.34","LST",""
"6410624","JMP DG BALL W RPE PRP 1EA","JUMP","2","1","13.99","6.4","LST",""
"6410628","JMP DG RND PZL 1EA","JUMP","4","1","28.99","13","LST",""
"6410629","JMP DG FTCH BALL 3PK","JUMP","0","1","13.99","6.8","LST",""
"6410633","JMP DG SPKY TRT STCK RED 1SM","JUMP","0","1","9.99","4.67","LST",""
"6410694","JMP DG BOUNCE BALL TURQ 2PK","JUMP","0","1","15.99","7.27","LST",""
"6410744","JMP DG DNTL SQKR BAL RED 2.5IN","JUMP","0","1","4.19","1.88","OOS",""
"6410745","JMP DG DNTL SQKR BAL YLW 3.5IN","JUMP","0","1","5.19","2.47","OOS",""
"6410747","JMP DG DNTL SQKR BONE BLU 1MD","JUMP","0","1","8.29","4.11","LST",""
"6410750","JMP DG DNTL SQKR BAL GRN 3.5IN","JUMP","0","1","5.19","2.47","LST",""
"6410753","JMP DG DNTL SQKR BONE PRP 1MD","JUMP","0","1","8.29","4.11","LST",""
"6411356","WER CT WX TLP&TU PUREE 3OZ","WERUVA","0","12","2.99","1.8042","LST",""
"E9039","CHUCKIT DG RUGGED FLYER 1EA","CHUCKIT","0","1","17.99","11.42","LST",""
"E9033","CHUCKIT DG ULTRA SQKR SM 2PC","CHUCKIT","1","1","15.99","8.47","LST",""
"X8608","CHUCKIT DG ROPE FETCH 1EA","CHUCKIT","1","1","28.99","19.87","LST",""
"6445934","JMP LINES WAVE SCRTCH 1MD","JUMP","0","1","13.99","6.76","LST",""
"6445936","JMP MRBL INFNTY SCRTCH 1EA","JUMP","0","1","21.99","10.39","LST",""
"6445983","JMP CRTN FISH SCRTCH 1MD","JUMP","0","1","9.99","5.25","LST",""
"6445999","RPT DG KANGA CHEW 2pc","ROAM PET TREATS","3","1","22.99","11.5","LST",""
"6446000","RPT DG MEGA ROO 1ea","ROAM PET TREATS","1","1","29.99","15","ROS",""
"6445932","JMP CRTN CATS SCRTCH 1MD","JUMP","2","1","9.99","5.25","LST",""
"6445933","JMP TERRAZZO SCRTCH 1XXL","JUMP","0","1","27.99","14.02","LST",""
"6445935","JMP LEAVES WAVE SCRTCH 1XXL","JUMP","2","1","27.99","14.04","LST",""
"6445995","RPT DG FUNNY BONE 1ea","ROAM PET TREATS","2","1","35.99","18","ROS",""
"6445998","RPT DG ROO CHOPPER SMMD","ROAM PET TREATS","2","1","19.99","10","ROS",""
"6410339","PERF PRM CT GF CHK KIT 5.5OZ","PERFORMATRIN PRIME","0","24","2.99","1.6742","LST","23615"
"6410341","PERF PRM CT GF BF AD 5.5OZ","PERFORMATRIN PRIME","0","24","2.99","1.6742","LST","22253"
"6410344","PERF PRM CT GF CHK KIT 13.2OZ","PERFORMATRIN PRIME","0","12","4.99","2.7942","LST","22255"
"6410345","PERF PRM CT GF TURKEY 13.2OZ","PERFORMATRIN PRIME","0","12","4.99","2.7942","LST","22261"
"6410347","PERF PRM CT GF WHTFSH AD13.2OZ","PERFORMATRIN PRIME","0","12","4.99","2.7942","LST","22259"
"6410348","PERF PRM CT CK&TK SNR 13.2OZ","PERFORMATRIN PRIME","0","12","4.99","2.7942","LST","22251"
"6410349","PERF PRM CT INDR SL 13.2OZ","PERFORMATRIN PRIME","0","12","4.99","2.7942","LST","22254"
"6410353","PERF PRM DG CHK AD 13.2OZ","PERFORMATRIN PRIME","0","12","3.99","2.2342","LST","21285"
"6410535","JMP DG DINO RPE 1EA","JUMP","0","1","21.99","11","LST",""
"6410340","PERF PRM CT GF TURKEY 5.5OZ","PERFORMATRIN PRIME","0","24","2.99","1.6742","LST","22262"
"6410342","PERF PRM CT HWGT WHTFSH 5.5OZ","PERFORMATRIN PRIME","0","24","2.99","1.6742","LST","23617"
"6410543","JMP DG TUFF OCPS 1EA","JUMP","0","1","21.99","10","LST",""
"6410343","PERF PRM CT HWGT TK 5.5OZ","PERFORMATRIN PRIME","24","24","2.99","1.6742","LST","23618"
"6410346","PERF PRM CT GF CHK AD 13.2OZ","PERFORMATRIN PRIME","12","12","4.99","2.7942","LST","22256"
"6410350","PERF PRM DG CHK SNR 13.2OZ","PERFORMATRIN PRIME","0","12","3.99","2.2342","LST","21288"
"6410547","JMP DG ALLIG W TRT DSP 1EA","JUMP","1","1","22.99","11","LST",""
"6410351","PERF PRM DG CHK PUP 13.2OZ","PERFORMATRIN PRIME","0","12","3.99","2.2342","LST","21281"
"6410553","JMP DG CROISSANT PLSH 1EA","JUMP","1","1","12.99","5.82","LST",""
"6410352","PERF PRM DG HWGT CHK 13.2OZ","PERFORMATRIN PRIME","0","12","3.99","2.2342","LST","21289"
"6410567","JMP DG GLOW BALL 1EA","JUMP","0","1","13.99","6.31","LST",""
"6410530","JMP DG ORG BURW 3PC","JUMP","0","1","21.99","11","LST",""
"6410537","JMP DG TUFF CRT 1EA","JUMP","0","1","15.99","7.02","LST",""
"6410538","JMP DG TUFF AVOCADO 1EA","JUMP","0","1","17.99","7.95","LST",""
"6410555","JMP DG PRETZEL PLSH 1EA","JUMP","0","1","13.99","6.31","LST",""
"6410559","JMP DG BNA PLSH 1EA","JUMP","0","1","15.99","7.28","LST",""
"6410565","JMP DG TPR PRNTING STCK 1EA","JUMP","0","1","13.99","6.5","LST",""
"6410573","JMP DG BEE SNUFFLE 1EA","JUMP","0","1","31.99","15.5","ROS",""
"6410582","JMP DG TENIS BALL 4PK","JUMP","0","1","15.99","7.06","ROS",""
"6411352","JMP DG STUFFABLZ ORG 1MD","JUMP","5","1","9.99","5","ROS",""
"6411353","JMP DG STUFFABLZ PRP 1LG","JUMP","0","1","12.99","6.5","ROS",""
"6446096","HD DG PRIDE COLLAR TIE 1LG","HOTEL DOGGY","0","1","13.99","7.5","LST",""
"6446094","HD DG PRIDE COLLAR TIE 1SM","HOTEL DOGGY","0","1","11.99","6.5","LST",""
"6446095","HD DG PRIDE COLLAR TIE 1MD","HOTEL DOGGY","0","1","12.99","7","LST",""
"6410640","JMP DG TRN ARD PZL 1EA","JUMP","1","1","25.99","12.5","LST",""
"6410643","JMP DG POKER BOX LEVER 1EA","JUMP","1","1","9.99","5.2","ROS",""
"6410645","JMP DG POKER BOX SCPS 1EA","JUMP","3","1","9.99","5.21","ROS",""
"6410646","JMP DG POKER BOX SLW FDR 1EA","JUMP","0","1","9.99","5.21","ROS",""
"6410674","JMP DG RCYCLD PLSH PIG 1EA","JUMP","0","1","15.99","8","LST",""
"6410675","JMP DG RCYCLD PLSH ELPH 1EA","JUMP","8","1","15.99","8","LST",""
"6410690","JMP DG PB SCNT BONE 1EA","JUMP","0","1","14.99","7.5","ROS",""
"6410641","JMP DG ADCD FLIP BOARD 1EA","JUMP","0","1","19.99","10.2","ROS",""
"6410642","JMP DG POKER BOX LVL 1 1EA","JUMP","0","1","29.99","15.5","ROS",""
"6410644","JMP DG POKER BOX CSNO 1EA","JUMP","0","1","9.99","5.2","ROS",""
"6410679","JMP DG TBONE BCN SM","JUMP","1","1","9.99","4.67","LST",""
"6410681","JMP DG TBONE BCN LG","JUMP","0","1","19.99","9.5","LST",""
"6410734","B&B HDWY BED GRY 20IN","BAILEY & BELLA","0","1","56.99","28.08","ROS",""
"6410735","B&B HDWY BED GRY 24IN","BAILEY & BELLA","0","1","69.99","33.26","LST",""
"6410736","B&B HDWY BED GRY 28IN","BAILEY & BELLA","0","1","79.99","38.46","ROS",""
"6446046","JMP CT RACE N SCRTCH 1EA","JUMP","0","1","25.99","11.44","LST",""
"6446047","JMP CT RACE N SCRTCH PADS 2PC","JUMP","0","1","14.99","6.25","LST",""
"6410696","PERF ULT DG SWT POT 11.6OZ","PERFORMATRIN ULTRA","2","1","14.99","7.9","LST","1050002"
"6410698","PERF ULT DG SWT POT FRS 9.9OZ","PERFORMATRIN ULTRA","4","1","16.49","8.25","LST","1050004"
"6410699","PERF ULT DG L&SP CHWS 5.6OZ","PERFORMATRIN ULTRA","1","1","8.49","4.24","LST","1050006"
"6410701","PERF ULT DG OCEAN STIX 7OZ","PERFORMATRIN ULTRA","0","1","9.99","4.6","LST","1103760"
"6410704","PERF ULT DG SWT POT 24OZ","PERFORMATRIN ULTRA","1","1","26.99","15","LST","1103849"
"6446108","PUR DG CHOW PUP CHK 14 LBS","PURINA","2","1","25.99","21.3","LST","13230"
"6410695","PERF ULT DG SWT POT 5.6OZ","PERFORMATRIN ULTRA","3","1","8.49","3.74","LST","1050001"
"6410697","PERF ULT DG SWT POT FRS 4.8OZ","PERFORMATRIN ULTRA","0","1","8.99","4.49","LST","1050003"
"6410700","PERF ULT DG FOOTHLLS STIX 7OZ","PERFORMATRIN ULTRA","0","1","9.99","4.6","LST","1103759"
"6410702","PERF ULT DG PRAIRIE STIX 7OZ","PERFORMATRIN ULTRA","1","1","9.99","4.6","LST","1103761"
"6410703","PERF ULT DG ORIGINAL STIX 7OZ","PERFORMATRIN ULTRA","0","1","9.99","4.6","LST","1103762"
"6469887","PRODEN CT PLAQUEOFF 40g","PRODEN","0","1","22.99","11.5","OOS",""
"6446338","BECO CT WATER ANML CLPSTRP 1EA","BECO PETS","0","1","119.88","59.94","INOT",""
"6446271","PAIK DG RECOVERY SHIRT GRY 40","PAIKKA","0","1","69.99","41.8","INOT",""
"6446273","PAIK DG RECOVERY SHIRT GRY 50","PAIKKA","0","1","69.99","41.8","INOT",""
"6446166","B&B F23 POLO SHRT MLTCOL M","BAILEY & BELLA","0","1","32.99","17","INOT",""
"6446180","B&B DG F24 CAMP HDY ORN S","BAILEY & BELLA","0","1","34.99","14","INOT",""
"6446269","PAIK DG RECOVERY SHIRT GRY 30","PAIKKA","0","1","69.99","40.3","INOT",""
"6446270","PAIK DG RECOVERY SHIRT GRY 35","PAIKKA","0","1","69.99","41.8","INOT",""
"6446272","PAIK DG RECOVERY SHIRT GRY 45","PAIKKA","1","1","69.99","41.8","INOT",""
"6446274","PAIK DG RECOVERY SHIRT GRY 55","PAIKKA","0","1","74.99","43.3","INOT",""
"E7771","FLEXI CAT CLSC CORD BK XS 10FT","FLEXI","0","1","15.99","9.25","LST",""
"6446255","NB CT LI CHK&GPEA 4LB","NATURAL BALANCE","0","1","34.99","21.08","LST","18744"
"6446256","NB CT LI SL&GPEA 4LB","NATURAL BALANCE","2","1","34.99","21.08","LST","18748"
"6446257","NB CT LI RS DK&GPEA 4LB","NATURAL BALANCE","2","1","34.99","22.59","LST","18743"
"6229851","CSTL CT ADJ SUSHI BLUE 1EA","COASTAL PET PRODUCTS","1","1","13.99","6.5","LST",""
"6446178","CSTL CT ADJ MSH HRN&LSH BK 1EA","COASTAL PET PRODUCTS","0","1","24.99","12.5","LST",""
"J3799","CSTL KTN COL ELASTICIZED BLUE","COASTAL PET PRODUCTS","1","1","9.99","5.03","LST",""
"Q5075","CSTL CT RFLCTV STRTCH BLK","COASTAL PET PRODUCTS","0","1","9.99","5.2","LST",""
"1501826","GD JFM ROOSTER WHT 1XS","GO DOG","0","1","12.99","6.31","LST",""
"43181","GODG DG CHEW DRAGON BLUE 1LSM","GO DOG","0","1","19.99","9.77","ROS",""
"63872","GO DOG CORDUROY MINI ROOSTER","GO DOG","2","1","23.99","11.96","LST",""
"6446082","ESN DG WIPES UNSCNTD 100PK","ESSENTIALS","2","1","12.99","5.2","LST","50579"
"44909","PRODEN PLAQUEOFF 60g","PRODEN","0","1","29.99","16.95","LST",""
"6446083","ESN CT WIPES UNSCNTD 100PK","ESSENTIALS","1","1","12.99","5.2","LST",""
"6446210","B&B F24 COZY FLCE ONS BLK S","BAILEY & BELLA","0","1","39.99","16","INOT",""
"6446211","B&B F24 COZY FLCE ONS BLK M","BAILEY & BELLA","0","1","39.99","16","INOT",""
"6446212","B&B F24 COZY FLCE ONS BLK L","BAILEY & BELLA","0","1","39.99","16","INOT",""
"6446247","B&B F23 ARGYLE ONS MLTCOL S","BAILEY & BELLA","0","1","27.99","11.2","INOT",""
"6410050","WER DG MNM STK FRT CUP 3.5 OZ","WERUVA","12","12","3.89","2.4033","LST",""
"6410052","WER DG MNM GM CH SP CUP3.5 OZ","WERUVA","12","12","3.89","2.4033","LST",""
"6410055","WER DG MNM VRTY 10PK CUP3.5OZ","WERUVA","2","1","37.99","24.03","LST",""
"6410058","BFF DG MNCKN CUP 2.75 OZ","B.F.F.","12","12","3.19","1.8042","LST",""
"6410061","BFF DG KS THR CUP 2.75 OZ","B.F.F.","12","12","3.19","1.8042","LST",""
"6410063","BFF DG VRTY 8PK CUP 2.75OZ","B.F.F.","2","1","23.99","14.4","LST",""
"6410048","WER DG MNM PW LK CHK CUP3.5OZ","WERUVA","12","12","3.89","2.4033","LST",""
"6410053","WER DG MNM AMZN LVN CUP 3.5OZ","WERUVA","12","12","3.89","2.4033","LST",""
"6410054","WER DG MNM WOK DG CUP 3.5 OZ","WERUVA","12","12","3.89","2.4033","LST",""
"6410056","BFF DG RL DCE CUP 2.75OZ","B.F.F.","12","12","3.19","1.8042","LST",""
"6410057","BFF DG LCK CUP 2.75 OZ","B.F.F.","12","12","3.19","1.8042","LST",""
"6410059","BFF DG MLS NC CUP 2.75 OZ","B.F.F.","12","12","3.19","1.8042","LST",""
"6410062","BFF DG WN BWT CUP 2.75 OZ","B.F.F.","12","12","3.19","1.8042","LST",""
"6446142","OPFM DG GF PUP CHK&SLM 4LB","OPEN FARM","2","1","35.99","24.1","LST",""
"6446143","OPFM DG GF PUP CHK&SLM 22LB","OPEN FARM","0","1","113.99","77.43","LST",""
"6446154","BLU DG AD WILD WG SLM 24 LB","BLUE BUFFALO","0","1","84.99","65.92","LST",""
"6446156","BLU DG AD LB WILD WG CHK 24LB","BLUE BUFFALO","0","1","84.99","63.67","LST",""
"6446158","BLU PUP WILD WG CHK 4.5LB","BLUE BUFFALO","0","1","33.99","21.09","LST",""
"6446159","BLU DG SB WILD WG CHK 4.5LB","BLUE BUFFALO","2","1","33.99","21.09","LST",""
"6446144","OPFM DG GF SMBR CHK&TRK 4LB","OPEN FARM","2","1","35.99","24.1","LST",""
"6446149","BLU DG AD WILD WG CHK 24 LB","BLUE BUFFALO","2","1","84.99","63.67","LST",""
"6446150","BLU DG AD WILD WG CHK 4.5 LB","BLUE BUFFALO","2","1","33.99","21.09","LST",""
"6446151","BLU DG AD WILD WG DCK 24 LB","BLUE BUFFALO","0","1","84.99","65.92","LST",""
"6446152","BLU DG AD WILD WG DCK 4.5LB","BLUE BUFFALO","0","1","33.99","23.07","LST",""
"6446153","BLU DG AD WILD WC WG CHK 24LB","BLUE BUFFALO","0","1","84.99","63.67","LST",""
"6446155","BLU DG AD WILD WG SLM 4.5 LB","BLUE BUFFALO","1","1","33.99","23.07","LST",""
"6446157","BLU PUP LB WILD WG CHK 24LB","BLUE BUFFALO","0","1","84.99","63.67","LST",""
"6446252","CAN FRESH DG VEG 13OZ","CANADA FRESH","0","12","5.59","4.0267","LST",""
"G9952","CAN FRSH DG DUCK 13OZ","CANADA FRESH","12","12","6.29","4.455","LST",""
"G9953","CAN FRESH DG LMB 13OZ","CANADA FRESH","12","12","5.59","4.0267","LST",""
"G9962","CAN FRESH DG SL 13OZ","CANADA FRESH","0","12","4.59","3.36","LST",""
"G9954","CAN FRESH DG BF 13OZ","CANADA FRESH","0","12","5.49","3.9108","LST",""
"X0799","CAN FRSH DG CHK 13OZ","CANADA FRESH","0","12","3.89","2.74","LST",""
"6410783","M&M DG CHERRY LSH 3/5IN 6 FT","MAX & MOLLY URBAN PETS","1","1","27.99","14.04","LST",""
"6410792","M&M DG CHERRY CLR XS","MAX & MOLLY URBAN PETS","1","1","20.99","10.45","LST",""
"6410793","M&M DG CHERRY CLR SM","MAX & MOLLY URBAN PETS","1","1","24.99","12.47","LST",""
"6410814","M&M DG DONUT HRN MD","MAX & MOLLY URBAN PETS","1","1","47.99","24.2","LST",""
"6410815","M&M DG DONUT HRN LG","MAX & MOLLY URBAN PETS","1","1","55.99","28.2","LST",""
"6410784","M&M DG CHERRY LSH 1IN 6FT","MAX & MOLLY URBAN PETS","1","1","33.99","17.2","LST",""
"6410794","M&M DG CHERRY CLR MD","MAX & MOLLY URBAN PETS","1","1","27.99","14.03","LST",""
"6410795","M&M DG CHERRY CLR LG","MAX & MOLLY URBAN PETS","1","1","31.99","15.65","LST",""
"6410800","M&M DG CHERRY HRN XS","MAX & MOLLY URBAN PETS","1","1","36.99","18.4","LST",""
"6410801","M&M DG CHERRY HRN SM","MAX & MOLLY URBAN PETS","1","1","39.99","20.35","LST",""
"6410802","M&M DG CHERRY HRN MD","MAX & MOLLY URBAN PETS","1","1","47.99","24.2","LST",""
"6410803","M&M DG CHERRY HRN LG","MAX & MOLLY URBAN PETS","1","1","55.99","28.2","LST",""
"6410812","M&M DG DONUT HRN XS","MAX & MOLLY URBAN PETS","1","1","36.99","18.4","ROS",""
"6410813","M&M DG DONUT HRN SM","MAX & MOLLY URBAN PETS","1","1","39.99","20.35","LST",""
"6446447","GO! CT SENS LID GF INST. SMP","GO! SOLUTIONS","2","1","1.49","0.05","LST",""
"6446448","GO! CT SENS LID GF INST. 3LB","GO! SOLUTIONS","0","1","31.99","21.58","LST",""
"6446481","NM CT JFC S&O RMVR 946ML","NATURE'S MIRACLE","2","1","19.99","8.9","LST","44371"
"6446449","GO! CT SENS LID GF INST. 6LB","GO! SOLUTIONS","0","1","49.99","33.72","LST",""
"6468232","HK CT GF CLSTR CHKN & FISH 4LB","THE HONEST KITCHEN","2","1","39.99","28.35","LST",""
"6468233","HK CT GF CLSTR CHICKEN 4LB","THE HONEST KITCHEN","1","1","39.99","28.35","LST",""
"6468229","HK CT GF CLSTR CHICKEN 1LB","THE HONEST KITCHEN","2","1","12.99","8.72","LST",""
"6468230","HK CT GF CLSTR CHKN & FISH 1LB","THE HONEST KITCHEN","0","1","12.99","8.72","LST",""
"6468231","HK CT GF CLSTR TRKY &CHCKN 1LB","THE HONEST KITCHEN","1","1","12.99","8.72","LST",""
"6468234","HK CT GF CLSTR TRKY & CHKN 4LB","THE HONEST KITCHEN","1","1","39.99","28.35","LST",""
"6410448","JMP W23 REINDEER 1SM","JUMP","1","1","14.99","7.5","INOT",""
"6446063","OPFM CT FD SL&COD 3.5OZ","OPEN FARM","0","1","12.99","8.64","LST",""
"6446064","OPFM CT FD HRVST CHK 9OZ PCH","OPEN FARM","2","1","29.99","19.94","LST",""
"6446065","OPFM CT FD CHK&SL 9OZ PCH","OPEN FARM","0","1","29.99","19.94","LST",""
"6446068","OPFM CT GF KIT CHK&TK 4LB","OPEN FARM","0","1","35.99","22.6","LST",""
"6446061","OPFM CT FD HRVST CHK 3.5OZ","OPEN FARM","0","1","12.99","8.64","LST",""
"6446062","OPFM CT FD CHK&SL 3.5OZ","OPEN FARM","3","1","12.99","8.64","LST",""
"6446066","OPFM CT FD SL&COD 9OZ PCH","OPEN FARM","0","1","29.99","19.94","LST",""
"6446342","B&B C X23 SQN SWTR 2XS","BAILEY & BELLA CELEBRATES","0","1","36.99","14.8","INOT",""
"6446599","BFF X23 GEFILITE FISH ROPE 1EA","#BFF","0","1","9.99","5.2","INOT",""
"6640014","OPFM CT GF KIT CHK&TK 2LB","OPEN FARM","2","1","18.99","11.96","LST",""
"6408543","ARK DG PROTCTN+ DENTL MINI4oz","ARK NATURALS","0","1","14.99","7.45","LST",""
"6408544","ARK DG PROTCTN+ DENTL SM 12oz","ARK NATURALS","1","1","31.99","15.8","LST",""
"6408546","ARK DG PROTCTN+ DENTL LG18oz","ARK NATURALS","2","1","45.99","21.75","LST",""
"6445922","LJ DG TROP PARADISE SMBR 3oz","LORD JAMESON","0","1","11.99","5.8","LST",""
"6446335","GO! DG SENS LID GF INSCT SMP","GO! SOLUTIONS","2","1","1.49","0.05","LST",""
"6446336","GO! DG SENS LID GF INSCT 3.5LB","GO! SOLUTIONS","0","1","29.99","20.23","LST",""
"6446341","ARK DG SFT SD PRO TPST SM12oz","ARK NATURALS","2","1","31.99","15.5","LST",""
"6445921","LJ DG VERY BERRY SMBR 3oz","LORD JAMESON","0","1","11.99","5.8","LST",""
"6445923","LJ DG CONFETTI CAKE SMBR 3oz","LORD JAMESON","0","1","11.99","5.8","LST",""
"6446337","GO! DG SENS LID GF INSCT 12LB","GO! SOLUTIONS","0","1","79.99","53.95","LST",""
"6446340","ARK DG XTRM BRSHLS TPST LG18oz","ARK NATURALS","1","1","37.99","18.75","LST",""
"IA874","CATIT ADJ HRN&LSH SET BLK 1SM","CATIT","0","1","21.99","10.7","LST",""
"II829","CATIT ADJ HRN&LSH SET BLK 1LG","CATIT","1","1","24.99","12.16","LST",""
"Z0036","CATIT ADJ HRN&LSH SET BLK 1MD","CATIT","0","1","22.99","11.18","LST",""
"6446442","B&B C X23 WP PLSHTW TPE 1EA","BAILEY & BELLA CELEBRATES","0","1","89.99","42","INOT",""
"6446630","CP SUSPENDER BTS BLK LONG SZ1","CANADA POOCH","0","1","75.99","41.79","INOT",""
"6446631","CP SUSPENDER BTS BLK LONG SZ2","CANADA POOCH","0","1","75.99","41.79","INOT",""
"6252303","JAYS DG TINY BITS TRAINING16oz","JAY'S","1","1","19.99","10.36","LST",""
"6446459","BFF WW DG FROG SPIKE RING 1EA","#BFF","0","1","13.99","7.13","INOT",""
"6446465","BFF NRDC DG OWL ROPE LEG 1EA","#BFF","0","1","23.99","12.48","INOT",""
"6446467","BFF NRDC DG MINI 3PC","#BFF","0","1","15.99","8.32","INOT",""
"6446452","BFF WW DG TODSTOOL BUNGEE 1EA","#BFF","0","1","13.99","7.13","INOT",""
"6446457","BFF WW DG LAMA SPIKE NECK 1EA","#BFF","0","1","19.99","11.17","INOT",""
"6446460","BFF WW DG SLOTH ROPE LEG 1EA","#BFF","0","1","19.99","10.92","INOT",""
"6446466","BFF NRDC DG SPIDER BALL 1EA","#BFF","0","1","15.99","8.25","INOT",""
"6446254","NB DG PB CRUNCHY 14oz","NATURAL BALANCE","0","1","19.99","10.33","OOS",""
"6446253","NB DG PB CRUNCHY SM BREED8oz","NATURAL BALANCE","0","1","12.99","4.8","LST",""
"6466822","HK CT CHKN MINCED 5.5OZ","THE HONEST KITCHEN","12","12","5.29","3.49","LST",""
"6466831","HK CT BEEF CHKN CATE 5.5 OZ","THE HONEST KITCHEN","12","12","5.29","3.49","LST",""
"6466832","HK CT CHKN CATE 5.5 OZ","THE HONEST KITCHEN","12","12","5.19","3.49","LST",""
"6466823","HK CT TURKEY MINCED 5.5OZ","THE HONEST KITCHEN","12","12","5.29","3.49","OOS",""
"6466824","HK CT TURKEY DUCK MNCED 5.5OZ","THE HONEST KITCHEN","12","12","5.19","3.49","LST",""
"6447016","GO! DG S&C WG LB AD SLM 12 LB","GO! SOLUTIONS","0","1","57.99","39.11","LST",""
"6447017","GO! DG S&C WG LB AD SLM 25 LB","GO! SOLUTIONS","0","1","99.99","67.44","LST",""
"6447018","GO! DG S&C WG LB PUP SLM 12 LB","GO! SOLUTIONS","0","1","60.99","41.14","LST",""
"6447019","GO! DG S&C WG LB PUP SLM 25 LB","GO! SOLUTIONS","0","1","105.99","71.49","LST",""
"6227534","TIKI CT AFTRDRK VRTY 12PK2.8OZ","TIKI CAT","0","1","34.99","24.85","LST",""
"6445985","JMP CT WILLOW TREE 17IN","JUMP","0","1","94.99","50.83","LST",""
"6446085","JMP CT MAISIE TREE 50IN","JUMP","0","1","209.99","115","LST",""
"6446088","JMP CT MONTY TREE 36IN","JUMP","0","1","149.99","75","LST",""
"6446089","JMP CT REPL POST 12.5IN","JUMP","1","1","17.99","9","LST",""
"6446090","JMP CT REPL POST 18.8IN","JUMP","1","1","20.99","10.5","LST",""
"6445984","JMP CT DELILAH CONDO 26IN","JUMP","0","1","129.99","77.96","LST",""
"6446084","JMP CT MIMI TREE 62IN","JUMP","0","1","199.99","115.37","LST",""
"6446086","JMP CT CLEO TREE 24IN","JUMP","0","1","114.99","62.37","LST",""
"6446087","JMP CT SIMBA TREE 23IN","JUMP","1","1","99.99","52.2","LST",""
"6446091","JMP CT HEAD SCRTCH 1EA","JUMP","6","6","31.99","16","LST",""
"6228758","FL BGB COL ENCNG FLKS 1.5OZ","FLUVAL","0","1","11.99","5.5","LST",""
"6228754","FL BGB BTA COL ENHG FLKS 0.6OZ","FLUVAL","0","1","8.99","3.5","LST",""
"6228755","FL BGB ALG CRSPS 1.4OZ","FLUVAL","0","1","7.99","4","LST",""
"6228759","FL BGB SPRLN FLKS 1.5OZ","FLUVAL","1","1","11.99","5.5","LST",""
"6447001","BURTS DG MH DEO SHMP BIL 16OZ","BURT'S BEES","0","1","16.99","8.9","LST",""
"6447002","BURTS DG MH ITCH SHMP BIL 16OZ","BURT'S BEES","0","1","16.99","8.9","LST",""
"6529889","FL BGB VCTN FD 0.7OZ","FLUVAL","0","1","6.99","3.5","LST",""
"E7902","FL BGB BTM FDR FRML PLCO 4.5OZ","FLUVAL","1","1","13.99","7.5","LST",""
"Y5330","FL BGB TROP FLKS 1.5OZ","FLUVAL","0","1","11.99","5.5","LST",""
"Y5332","FL BGB GLDFSH FLKS 1.5OZ","FLUVAL","0","1","12.99","5.5","LST",""
"6447220","RCFHN CT KIT MTHR&BBC 3LB","ROYAL CANIN","1","1","38.99","22.9","LST","28624"
"6447223","RCFHN CT APPT CTRL 14LB","ROYAL CANIN","2","1","117.99","76.7","LST","G8363"
"6447224","RCFHN CT APPT CTRL 3LB","ROYAL CANIN","1","1","38.99","25.3","LST","18475"
"6447219","RCFHN CT MTHR&BBC 6LB","ROYAL CANIN","2","1","75.99","47.12","LST","IR425"
"6447221","RCFHN CT KIT 14LB","ROYAL CANIN","0","1","118.99","71.8","LST","6227238"
"6447222","RCFHN CT KIT 3LB","ROYAL CANIN","0","1","38.99","22.9","LST","18432"
"35124","RCBHN FRENCH BULLDOG 17LB","ROYAL CANIN","2","1","88.99","55.93","LST",""
"6446591","RCBHN DG MINI SCHNR PUP 2.5LB","ROYAL CANIN","2","1","37.99","22.85","LST",""
"6446592","RCBHN DG PUG PUP 2.5LB","ROYAL CANIN","2","1","37.99","22.85","LST",""
"6446593","RCBHN FRENCH BULLDOG PUP 3LB","ROYAL CANIN","2","1","37.99","22.85","LST",""
"6446595","RCCHN DG LG PUP THN GRY 13OZ","ROYAL CANIN","12","12","5.29","3.2175","LST",""
"6446597","RCCHN XS PUP THN GRY 3OZ","ROYAL CANIN","24","24","3.09","1.6796","LST",""
"6446869","RCSHN DG SM PUPPY 14LB","ROYAL CANIN","0","1","88.99","57.63","LST","13547"
"6446872","RCSHN DG GIANT 30LB","ROYAL CANIN","0","1","119.99","80.2","LST","24844"
"6446596","RCCHN DG MD PUP THN GRY 13OZ","ROYAL CANIN","12","12","5.29","3.2175","LST",""
"6446870","RCSHN DG LRG PUPPY 17LB","ROYAL CANIN","2","1","88.99","56.35","LST","IL225"
"6446871","RCSHN DG LRG PUPPY 30LB","ROYAL CANIN","2","1","126.99","82.38","LST","20403"
"6446879","RCSHN DG LARGE 30LB","ROYAL CANIN","0","1","119.99","74.55","LST","20414"
"18390","RCFCN CT INDR WGT CARE 3LB","ROYAL CANIN","0","1","38.99","25.3","LST",""
"28634","RCFHN CT INDR HB CARE 3LB","ROYAL CANIN","0","1","38.99","25.3","LST",""
"28647","RCFHN CT DGST CARE AD 3LB","ROYAL CANIN","1","1","38.99","25.3","LST",""
"6446896","GFP RECYCLED PARKA CAMO 1XXS","GF PET","0","1","54.99","28.54","INOT",""
"6446897","GFP RECYCLED PARKA CAMO 1XS","GF PET","0","1","61.99","32.17","INOT",""
"6446898","GFP RECYCLED PARKA CAMO 1SM","GF PET","0","1","63.99","33.21","INOT",""
"6447194","PPLN DG PUP SPORT CK&R 4LB","PURINA PRO PLAN","2","1","38.99","27.69","LST",""
"6447196","PPLN DG SNR 7+ CK&R 13OZ","PURINA PRO PLAN","12","12","4.39","3","LST",""
"6473640","PPLN DG SNR SS&S SL&R 24LB","PURINA PRO PLAN","0","1","107.99","74.41","LST",""
"66756","ET INFRD BASK SPT 75W","EXO TERRA","0","1","24.99","8.5","LST",""
"66757","ET HEAT GLO INFRD LMP 100W","EXO TERRA","0","1","25.99","10","LST",""
"E7964","ET NGHT HEAT LMP 100W","EXO TERRA","0","1","14.99","6.25","LST",""
"K1805","ET DAYTM HEAT LMP 100W","EXO TERRA","0","1","14.99","6.25","LST",""
"K1807","ET NGHT HEAT LMP 25W","EXO TERRA","0","1","13.99","5.75","LST",""
"K1804","ET DAYTM HEAT LMP 60W","EXO TERRA","0","1","14.99","6.25","LST",""
"K1806","ET DAYTM HEAT LMP 100W","EXO TERRA","0","1","14.99","6.25","LST",""
"K1808","ET NGHT HEAT LMP 50W","EXO TERRA","0","1","13.99","5.75","LST",""
"K1809","ET DAYLT BASK SPT LMP 50W","EXO TERRA","0","1","15.99","7.25","LST",""
"K1810","ET DAYLT BASK SPT LMP 75W","EXO TERRA","0","1","15.99","7.25","LST",""
"K1811","ET DAYLT BASK SPT LMP 100W","EXO TERRA","0","1","18.99","8.5","LST",""
"O7407","ET INFRD BASK SPT 50W","EXO TERRA","0","1","22.99","8.5","LST",""
"O7943","ET NGHT HEAT LMP 75W","EXO TERRA","0","1","13.99","5.75","OOS",""
"O8646","ET DAYTM HEAT LMP 150W","EXO TERRA","0","1","14.99","6.25","OOS",""
"Q8038","ET INFRD BASK SPT 150W","EXO TERRA","0","1","26.99","11.25","LST",""
"Z1222","ET DAYLT BASK SPT LMP 25W","EXO TERRA","0","1","14.99","6.75","LST",""
"1103985","SD DG AD SEN ST&SK TK&R 12.5OZ","HILL'S SCIENCE DIET","12","12","5.79","3.6975","LST",""
"6232820","HK DG WG BF 4LB","THE HONEST KITCHEN","0","1","64.99","44.96","LST",""
"6447176","SD DG AD PFWGT CHK 12LB","HILL'S SCIENCE DIET","1","1","91.99","63.97","LST","1103988"
"6447178","SD DG AD SB PRFT WGT 25LB","HILL'S SCIENCE DIET","0","1","125.99","95.44","LST","6234872"
"6447179","SD DG AD LB PRFT WGT 25LB","HILL'S SCIENCE DIET","1","1","125.99","95.44","LST","6234871"
"6447180","SD DG PUP LB LMB&BR 30LB","HILL'S SCIENCE DIET","0","1","115.99","87.6","LST","9100611"
"6447181","SD DG PUP CK&BR 27.5LB","HILL'S SCIENCE DIET","1","1","115.99","85.2","LST","1104005"
"6447185","INST DG RAW FD BF 9.5OZ","INSTINCT","0","1","34.99","23.79","LST",""
"6447188","INST DG RAW FD POLLOCK 9.5OZ","INSTINCT","0","1","46.99","31.95","LST",""
"6447189","INST DG RAW FD LAMB 9.5OZ","INSTINCT","0","1","37.99","27","LST",""
