"Item No","Item Description","Brand","Qty","Order Multiple","Retail Price","Wholesale Price","Life Cycle Status","Substituted Item"
"6227557","TIKI CT GRILL SRD CTLTS 2.8OZ","TIKI CAT","0","12","2.39","1.58","LST",""
"6227558","TIKI CT GRILL SRD&LOB 2.8OZ","TIKI CAT","0","12","2.39","1.58","LST",""
"6227559","TIKI CT LUAU CHK 6OZ","TIKI CAT","0","8","4.79","3.0225","LST",""
"6227560","TIKI CT LUAU CK&EGG 6OZ","TIKI CAT","8","8","4.79","3.0225","LST",""
"6227561","TIKI CT LUAU SL 6OZ","TIKI CAT","8","8","4.79","3.0225","LST",""
"6227562","TIKI CT LUAU SL&CK 6OZ","TIKI CAT","0","8","4.79","3.0225","LST",""
"6227563","TIKI CT LUAU TU&CK 6OZ","TIKI CAT","8","8","4.79","3.0225","LST",""
"6227564","TIKI CT LUAU TU&MK 6OZ","TIKI CAT","8","8","4.79","3.0225","LST",""
"6227565","TIKI CT LUAU TLP 6OZ","TIKI CAT","0","8","4.79","3.0225","ROS",""
"6227566","TIKI CT GRILL TUNA 6OZ","TIKI CAT","0","8","3.29","2.0963","LST",""
"6227567","TIKI CT GRILL TU&CRB 6OZ","TIKI CAT","0","8","3.29","2.0963","LST",""
"6227568","TIKI CT GRILL TU&CRB CNSM 6OZ","TIKI CAT","8","8","3.29","2.0963","LST",""
"6227569","TIKI CT GRILL TU&PRAWN 6OZ","TIKI CAT","0","8","3.29","2.0963","LST",""
"6227570","TIKI CT GRILL MK&SRD 6OZ","TIKI CAT","8","8","3.29","2.0963","LST",""
"6227571","TIKI CT GRILL SRD CTLTS 6OZ","TIKI CAT","8","8","3.29","2.0963","LST",""
"6227572","TIKI CT GRILL SRD&LOB 6OZ","TIKI CAT","8","8","3.29","2.0963","LST",""
"6227573","TIKI CT BRTHS VRTY 12PCH 1.3OZ","TIKI CAT","1","1","22.99","14.75","LST",""
"6227574","TIKI CT BRTHS CHK PCH 1.3OZ","TIKI CAT","0","12","1.99","1.2292","LST",""
"6227578","TIKI CT BRTHS TUNA PCH 1.3OZ","TIKI CAT","12","12","1.99","1.2292","LST",""
"6227582","TIKI CT ALOHA VRTY 12PK 3OZ","TIKI CAT","0","1","26.99","16.95","LST",""
"6227583","TIKI CT ALOHA TU&PMP 3OZ","TIKI CAT","0","12","2.29","1.5208","LST",""
"6227584","TIKI CT ALOHA TU&WF&PMP 3OZ","TIKI CAT","0","12","2.29","1.5208","LST",""
"6227585","TIKI CT ALOHA TU&TLP&PMP 3OZ","TIKI CAT","0","12","2.29","1.5208","LST",""
"6227586","TIKI CT ALOHA TU&SH&PMP 3OZ","TIKI CAT","0","12","2.29","1.5208","LST",""
"6227596","TIKI CT ALOHA TU&PMP 5.5OZ","TIKI CAT","0","8","3.69","2.4688","LST",""
"6227597","TIKI CT ALOHA TU&WF&PMP 5.5OZ","TIKI CAT","0","8","3.69","2.4688","LST",""
"6227598","TIKI CT ALOHA TU&TLP&PMP 5.5OZ","TIKI CAT","0","8","3.69","2.4688","LST",""
"6227599","TIKI CT ALOHA TU&SH&PMP 5.5OZ","TIKI CAT","0","8","3.69","2.4688","LST",""
"6227600","TIKI CT BRN CARN LGHT TK 2.8LB","TIKI CAT","0","1","39.99","26.48","LST",""
"6227601","TIKI CT BRN CARN CHK&EG 2.8LB","TIKI CAT","0","1","37.99","24.87","LST",""
"6227602","TIKI CT BRN CARN CHK&EG 5.6LB","TIKI CAT","1","1","64.99","40.64","LST",""
"6227603","TIKI CT BRN CARN CK&HRG 2.8LB","TIKI CAT","0","1","37.99","24.87","LST",""
"6227604","TIKI CT BRN CARN CK&HRG 5.6LB","TIKI CAT","2","1","64.99","40.64","LST",""
"6227605","TIKI CT BRN CARN HRG&SL 2.8LB","TIKI CAT","1","1","37.99","24.87","LST",""
"6227606","TIKI DG TMY PMP TPR PCH 1.5OZ","TIKI DOG","0","12","2.19","1.2842","OOS",""
"6227609","TIKI DG ALHA BST BF PCH 1.5OZ","TIKI DOG","0","12","2.19","1.2842","LST",""
"6227610","TIKI DG ALHA BST CHK PCH 1.5OZ","TIKI DOG","12","12","2.19","1.2842","LST",""
"6227612","TIKI DG MEATY CHK CUP 3OZ","TIKI DOG","4","4","3.59","2.1175","LST",""
"6227613","TIKI DG MEATY CK&EGG CUP 3OZ","TIKI DOG","4","4","3.59","2.1175","LST",""
"6227614","TIKI DG MEATY CK&DK CUP 3OZ","TIKI DOG","4","4","3.59","2.175","LST",""
"6227615","TIKI DG MEATY CK&BF CUP 3OZ","TIKI DOG","4","4","3.59","2.1175","LST",""
"6227616","TIKI DG MEATY CK&SL CUP 3OZ","TIKI DOG","4","4","3.59","2.1175","LST",""
"6227617","TIKI DG MEATY VRTY 10PKCUP 3OZ","TIKI DOG","2","1","36.99","21.7","LST",""
"6227618","TIKI DG WRLD ASIA CK&P CUP 3OZ","TIKI DOG","4","4","2.99","1.8975","LST",""
"6227619","TIKI DG WRLD FRNC B&P CUP 3OZ","TIKI DOG","4","4","2.99","1.8975","LST",""
"6227621","TIKI DG WRLD GR LB&CP CUP 3OZ","TIKI DOG","4","4","2.99","1.8975","LST",""
"6227623","TIKI DG WRLD VRTY 10PK 3OZ","TIKI DOG","2","1","29.99","20.48","LST",""
"6227642","ADTL DG CLR MD LG 1EA","ADAPTIL","0","1","44.99","25.36","LST",""
"6227643","ADTL DG CLR SM 1EA","ADAPTIL","0","1","44.99","25.36","LST",""
"6227645","ADTL DG REFIL 3PK","ADAPTIL","0","1","92.99","55","LST",""
"6227646","ADTL DG SPRAY 20ML","ADAPTIL","0","1","28.99","16.9","LST",""
"6227647","FELIWAY CT CLS REFIL 3PK","FELIWAY","0","1","92.99","54","LST",""
"6227649","FELIWAY CT FRD REFIL 3PK","FELIWAY","0","1","92.99","54","LST",""
"6227657","BLU DG TRU SLTN DGTV 22LB","BLUE BUFFALO","0","1","99.99","60.1","LST",""
"6227658","BLU DG TRU SLTN WTCRE 22LB","BLUE BUFFALO","0","1","99.99","60.1","LST",""
"6227660","BLU DG TRU SLTN SK&CO 22LB","BLUE BUFFALO","0","1","99.99","60.1","LST",""
"6227661","BLU DG TRU SLTN DGTV 5LB","BLUE BUFFALO","0","1","39.99","23.43","LST",""
"6227662","BLU DG TRU SLTN WTCRE 5LB","BLUE BUFFALO","0","1","39.99","23.74","OOS",""
"6227664","BLU DG TRU SLTN SK&CO 5LB","BLUE BUFFALO","0","1","39.99","23.74","LST",""
"6227665","BLU DG TRU SLTN SENSTM 12.5OZ","BLUE BUFFALO","0","12","5.29","3.1533","LST",""
"6227666","BLU DG TRU SLTN HWGT 12.5OZ","BLUE BUFFALO","0","12","5.29","3.1533","LST",""
"6227668","BLU DG TRU SLTN SKHLTH 12.5OZ","BLUE BUFFALO","0","12","5.29","3.1533","LST",""
"6227671","BLU CT TRU SLTN URINARY 15LB","BLUE BUFFALO","0","1","95.99","54.29","LST",""
"6227673","BLU CT TRU SLTN DGTV 6LB","BLUE BUFFALO","0","1","57.99","30.89","LST",""
"6227674","BLU CT TRU SLTN WTCRE 6LB","BLUE BUFFALO","0","1","57.99","30.89","LST",""
"6227675","BLU CT TRU SLTN URINARY 6LB","BLUE BUFFALO","2","1","57.99","30.89","LST",""
"6227677","BLU CT TRU SLTN DGTV 5.5OZ","BLUE BUFFALO","0","24","3.99","2.0854","LST",""
"6227678","BLU CT TRU SLTN WTCRE 5.5OZ","BLUE BUFFALO","24","24","3.99","2.0854","LST",""
"6227679","BLU CT TRU SLTN URINARY 5.5OZ","BLUE BUFFALO","0","24","3.99","2.0854","LST",""
"6227680","BLU CT TRU SLTN SK&CO 5.5OZ","BLUE BUFFALO","0","24","3.99","2.0854","LST",""
"6227681","BLU CT TRU SLTN DGTV 3OZ","BLUE BUFFALO","0","24","2.89","1.47","LST",""
"6227682","BLU CT TRU SLTN WTCRE 3OZ","BLUE BUFFALO","0","24","2.89","1.47","LST",""
"6227683","BLU CT TRU SLTN URINARY 3OZ","BLUE BUFFALO","0","24","2.89","1.47","LST",""
"6227762","ETTA DG DELUXE LAMB 7IN","ETTA SAYS!","0","20","4.39","2.35","LST",""
"6227763","ETTA DG DELUXE CHICKEN 7IN","ETTA SAYS!","0","20","4.39","2.35","LST",""
"6227764","ETTA DG DELUXE TURKEY 7IN","ETTA SAYS!","0","20","4.39","2.35","LST",""
"6227765","ETTA DG SELECT LIVER 7IN","ETTA SAYS!","0","20","4.29","2.15","LST",""
"6227766","ETTA DG SELECT SAUSAGE 7IN","ETTA SAYS!","0","20","4.29","2.15","LST",""
"6227767","ETTA DG SELECT BACON 7IN","ETTA SAYS!","0","20","4.29","2.15","LST",""
"6227830","PC DG BEEF STAKES8OZ","PET CENTER","1","1","24.99","12.19","LST",""
"6227831","PC DG BLLY WRP PZZLE W/JRKY9IN","PET CENTER","0","10","14.99","6.957","LST",""
"6227832","GRAN DG CT SARDINE TRTS90G","GRANVILLE ISLAND PET TREATERY","1","1","15.99","7.72","LST",""
"6227976","F4L NTRL PINE BDNG 20L","FRESH 4 LIFE","1","1","9.99","5","LST","57130"
"6227977","F4L NTRL PINE BDNG 41L","FRESH 4 LIFE","0","1","13.99","7","LST","35270"
"6227978","F4L NTRL PINE BDNG 125L","FRESH 4 LIFE","1","1","22.99","12.56","LST","35190"
"6227979","F4L NTRL ASPN BDNG 41L","FRESH 4 LIFE","1","1","13.99","7.69","LST","56067"
"6227980","F4L NTRL ASPN BDNG 125L","FRESH 4 LIFE","1","1","22.99","13.79","LST","56069"
"6228221","MRK PB CT COMPCRE HB CNTRL 4LB","MERRICK","0","1","34.99","22.58","OOS",""
"6228222","MRK PB CT COMPCRE SENS STM 4LB","MERRICK","0","1","34.99","22.58","LST",""
"6228670","GO! DG S&C WG DUCK 3.5LB","GO! SOLUTIONS","0","1","23.99","16.18","LST","25412"
"6228911","FLVL P25 PRST SBMRSBL HTR 25W","FLUVAL","1","1","31.99","15.56","LST",""
"6229235","FREEZER BAG - PET VALU 1EA","PET VALU","0","1","5.99","3","LST",""
"6229236","FREEZER BAG - PAULMAC'S 1EA","PET VALU","0","1","5.99","3","LST",""
"6229244","B&B SHLDR SOFT CARRIER GR 1SM","BAILEY & BELLA","0","1","79.99","40","LST",""
"6229245","B&B SHLDR SOFT CARRIER NV 1SM","BAILEY & BELLA","1","1","79.99","40","LST",""
"6229246","B&B EXPAND SOFT CARRIER GR 1MD","BAILEY & BELLA","0","1","109.99","55","LST",""
"6229248","B&B WHEEL SOFT CARRIER GR 1EA","BAILEY & BELLA","0","1","139.99","76","LST",""
"6229249","B&B BACKPACK CARRIER GR 1EA","BAILEY & BELLA","0","1","109.99","55","LST",""
"6229252","ESN COMPOST POOP BAG 60 PK","ESSENTIALS","1","1","5.99","3","LST",""
"6229253","ESN COMPOST POOP BAG 120 PK","ESSENTIALS","1","1","10.99","5.8","LST",""
"6229525","PUP SCOOPS DGCAKE MIX BNNA 9oz","PUPPY CAKE","1","1","11.99","6.17","LST",""
"6229545","SBONE DG BC&CHS MINI CHW11.8OZ","SMARTBONES","0","1","27.99","14.41","LST",""
"6229565","PERF NTRL DG HG BF AD SMP4OZ","PERFORMATRIN NATURALS","0","1","1.49","0.05","LST",""
"6229572","ESN EXERCISE PEN DOOR 24IN","ESSENTIALS","1","1","109.99","62.37","LST",""
"6229573","ESN EXERCISE PEN DOOR 36IN","ESSENTIALS","0","1","139.99","77.95","LST",""
"6229574","ESN EXERCISE PEN DOOR 42IN","ESSENTIALS","0","1","154.99","88.34","LST",""
"6229602","PERF ULT DG AG WDS LGBR SMP4OZ","PERFORMATRIN ULTRA","0","1","1.49","0.05","LST",""
"6229603","PERF ULT DG AG WDS SMP 4OZ","PERFORMATRIN ULTRA","1","1","1.49","0.05","LST",""
"6229604","PERF ULT CT GF FARMSTD SMP 4OZ","PERFORMATRIN ULTRA","0","1","2.49","0.05","LST",""
"6229615","ESN OPEN TOP PLASTIC CARR 1SM","ESSENTIALS","1","1","51.99","31.18","LST",""
"6229616","ESN OPEN TOP PLASTIC CARR 1MD","ESSENTIALS","1","1","72.99","41.57","LST",""
"6229619","GREENIES CT DNTL CATNIP 4.6OZ","GREENIES","0","1","7.49","4.61","LST",""
"6229620","GREENIES CT DNTL CATNIP 2.1OZ","GREENIES","1","1","4.49","2.77","LST","63986"
"6229622","GREENIES CT DNTL CHKN 4.6OZ","GREENIES","0","1","7.49","4.61","LST","11211"
"6229624","GREENIES CT DNTL SALMON 4.6OZ","GREENIES","1","1","7.49","4.61","LST","11215"
"6229627","GREENIES CT DNTL SALMON 2.1OZ","GREENIES","0","1","4.49","2.77","LST","11205"
"6229628","GREENIES CT DNTL CHKN 9.75OZ","GREENIES","0","1","13.99","10.37","LST","1101910"
"6229862","OH DG TORNADO PUZZLE 1EA","OUTWARD HOUND","2","1","29.99","16.71","LST",""
"6229863","OH DG BRICK PUZZLE 1EA","OUTWARD HOUND","1","1","31.99","17.59","LST",""
"6229864","OH DG TWISTER PUZZLE 1EA","OUTWARD HOUND","1","1","31.99","17.59","LST",""
"6229946","BB PLUSH RND BED GRY 1EA","BAILEY & BELLA","1","1","32.99","15.7","LST",""
"6229953","ADVNTG II KIT 2PK","ADVANTAGE","0","1","41.99","27.1","LST",""
"6229954","ADVNTG II CT SM 2PK","ADVANTAGE","2","1","46.99","30.3","LST",""
"6229955","ADVNTG II CT LG 2PK","ADVANTAGE","1","1","46.99","30.3","LST",""
"6229956","ADVNTG II DG SM 2PK","ADVANTAGE","0","1","46.99","30.3","LST",""
"6229957","ADVNTG II DG MD 2PK","ADVANTAGE","0","1","46.99","30.29","LST",""
"6229958","ADVNTG II DG LG 2PK","ADVANTAGE","0","1","51.99","33.54","LST",""
"6229959","ADVNTG II DG XL 2PK","ADVANTAGE","0","1","51.99","33.54","LST",""
"6229960","K9 ADVNTX DG SM 2PK","K9 ADVANTIX","0","1","58.99","37.36","LST",""
"6229961","K9 ADVNTX DG MD 2PK","K9 ADVANTIX","1","1","58.99","37.36","LST",""
"6229962","K9 ADVNTX DG LG 2PK","K9 ADVANTIX","0","1","64.99","41.27","LST",""
"6229963","K9 ADVNTX DG XL 2PK","K9 ADVANTIX","0","1","64.99","41.27","LST",""
"6229982","NB DG LID DK&POT 4LB","NATURAL BALANCE","0","1","32.99","20.81","LST","15919"
"6229983","NB DG LID SL&SP 24LB","NATURAL BALANCE","1","1","99.99","67.09","LST","15937"
"6229984","NB DG LID SL&SP 4LB","NATURAL BALANCE","1","1","31.99","18.04","LST","15935"
"6229987","NB DG LID SL&SP 12LB","NATURAL BALANCE","0","1","59.99","40.18","OOS","15936"
"6230031","NB DG SMBR LID DK&POT 4LB","NATURAL BALANCE","2","1","32.99","20.74","LST","15922"
"6230032","NB DG SMBR LID SL&SP 4LB","NATURAL BALANCE","0","1","31.99","18.04","LST","15938"
"6230061","NRTH BSC DG MINI M CND B&L450G","NORTHERN BISCUIT","0","1","16.99","8.26","LST",""
"6230062","NRTH BSC DG MINI M PPK&PNT450G","NORTHERN BISCUIT","0","1","16.99","8.26","LST",""
"6230067","PACFC 21 DG SLM JERKY VP4.93OZ","PACIFIC 21","1","1","27.99","15.26","OOS",""
"6230073","OXB HIDE & SEEK MAT 1SM","OXBOW","1","1","18.99","10.46","LST",""
"6230374","GFP F20 SMT PUFFER NVY XL","GF PET","0","1","56.99","25","INOT",""
"6230574","ER WIPES UNSCNTD 100CT","EARTH RATED","2","1","13.99","6.5","LST",""
"6230575","ER WIPES LVNDR 100CT","EARTH RATED","0","1","13.99","6.5","LST",""
"6230601","ZEAL DG TKY 2.2LB","ZEAL","0","1","65.99","41.06","OOS",""
"6231144","PET KELP SKIN& COAT CA 1EA","THE MISSING LINK","0","1","25.99","13.85","LST","43839"
"6231145","PET KELP JOINT& BONE CA 1EA","THE MISSING LINK","0","1","25.99","13.85","LST","43838"
"6231146","PET KELP PROBIOTIC CA 8OZ","THE MISSING LINK","0","1","25.99","13.85","LST","43861"
"6231175","ZEAL DG SLM 1LB","ZEAL","0","1","29.99","18.74","LST",""
"6232109","ESN DISP DIAPER 12XS","ESSENTIALS","1","1","21.99","9.35","LST","45635"
"6232110","ESN DISP DIAPER 12SM","ESSENTIALS","1","1","21.99","9.89","LST","45636"
"6232111","ESN DISP DIAPER 12MED","ESSENTIALS","0","1","22.99","10.38","LST","45637"
"6232112","ESN DISP DIAPER 12LG","ESSENTIALS","0","1","24.99","11.41","LST","45605"
"6232113","ESN DISP DIAPER 12XL","ESSENTIALS","0","1","25.99","12.97","LST","45606"
"6232120","ESN MALE DIAPER WRAP 12XS","ESSENTIALS","0","1","21.99","9.32","LST","1503375"
"6232121","ESN MALE DIAPER WRAP 12SM","ESSENTIALS","0","1","21.99","9.89","LST","1503376"
"6232122","ESN MALE DIAPER WRAP 12MD","ESSENTIALS","1","1","22.99","10.38","LST","1503377"
"6232124","ESN MALE DIAPER WRAP 12LG","ESSENTIALS","0","1","24.99","11.41","OOS","1503378"
"6232294","NRTH BSC DG BCN BLR 1.36KG","NORTHERN BISCUIT","0","1","33.99","17.96","LST","30595"
"6232295","NRTH BSC DG LIVER 1.36KG","NORTHERN BISCUIT","0","1","33.99","17.96","LST","1102563"
"6232296","NRTH BSC DG PUMPKIN PIE 1.36KG","NORTHERN BISCUIT","0","1","33.99","17.96","LST","30596"
"6232297","NRTH BSC DG PEANUT 1.36KG","NORTHERN BISCUIT","1","1","33.99","17.96","LST","1102564"
"6232424","GO! DG S&C TKY WGRAINS 3.5LB","GO! SOLUTIONS","0","1","21.99","14.83","LST",""
"6232429","GO! DG CNV GF LMB&BR 3.5LB","GO! SOLUTIONS","0","1","28.99","19.55","LST",""
"6232430","GO! DG CNV GF LMB&BR 12LB","GO! SOLUTIONS","1","1","75.99","51.25","LST",""
"6232431","GO! DG CNV GF LMB&BR 22LB","GO! SOLUTIONS","0","1","114.99","77.56","LST",""
"6232432","GO! DG CNV GF SL&COD 3.5LB","GO! SOLUTIONS","0","1","26.99","18.21","LST",""
"6232433","GO! DG CNV GF SL&COD 12LB","GO! SOLUTIONS","1","1","69.99","47.21","LST",""
"6232434","GO! DG CNV GF SL&COD 22LB","GO! SOLUTIONS","0","1","108.99","73.51","LST",""
"6232435","GO! DG SENS LID GF DUCK 12LB","GO! SOLUTIONS","0","1","73.99","49.9","LST",""
"6232436","GO! DG SENS LID GF LMB 12LB","GO! SOLUTIONS","0","1","74.99","50.58","LST",""
"6232438","GO! DG SENS LID GF SL 12LB","GO! SOLUTIONS","1","1","67.99","45.86","LST",""
"6232440","GO!DG SENS LIDGF SL SMBT 3.5LB","GO! SOLUTIONS","1","1","25.99","17.53","LST",""
"6232441","GO! DG SENS LID GF SL SMBT 6LB","GO! SOLUTIONS","1","1","42.99","29","LST",""
"6232442","GO!DG SENS LID GF SL SMBT 22LB","GO! SOLUTIONS","0","1","104.99","70.81","LST",""
"6232443","GO! CT S&C CHK 16LB","GO! SOLUTIONS","1","1","85.99","58","LST",""
"6232444","GO! CT S&C GF SL 3LB","GO! SOLUTIONS","0","1","24.99","16.86","LST",""
"6232445","GO! CT S&C GF SL 8LB","GO! SOLUTIONS","1","1","51.99","35.07","LST",""
"6232464","GO! CT CNV GF SL&COD 3LB","GO! SOLUTIONS","0","1","28.99","19.55","LST",""
"6232465","GO! CT CNV GF SL&COD 8LB","GO! SOLUTIONS","0","1","59.99","40.46","LST",""
"6232467","GO! CT SENS LID GF DUCK 16LB","GO! SOLUTIONS","2","1","105.99","71.49","LST",""
"6232603","CHUCKIT ULTRA FETCH STICK 1EA","CHUCKIT","1","1","14.99","7.49","LST",""
"6232604","CHUCKIT BREATHE RIGHT BALL 2MD","CHUCKIT","0","1","16.99","9.12","LST","1502268"
"6232607","CHUCKIT ULTRA SQUEAKER 2MD","CHUCKIT","0","1","16.99","9.42","LST","89504"
"6232642","ZIGNATURE DG LID SMBT KANGA4LB","ZIGNATURE","1","1","29.99","19.38","LST",""
"6232643","ZIGNATURE DGLIDSMBT KNG 12.5LB","ZIGNATURE","0","1","79.99","53.35","LST",""
"6232699","KONG SIGNATURE STICK 1MD","KONG","0","1","14.99","6.51","LST",""
"6232708","KONG CT PLAYSPACES CAMPER 1EA","KONG","1","1","32.99","15.48","ROS",""
"6232715","TIKI CAT TUNA CRUNCHERS 2OZ","TIKI CAT","6","6","5.69","3.3","LST",""
"6232725","VN CALM CARRIER 20IN","VAN NESS","0","1","79.99","54.25","LST",""
"6232734","OPFM DG TK&OAT ANCNT G 22LB","OPEN FARM","1","1","103.99","70.63","LST",""
"6232754","OPFM DG BF&OAT ANCNT G 22LB","OPEN FARM","1","1","109.99","74.71","LST",""
"6233000","ACANA CT RGNL WILD PR 9.9LB","ACANA","0","1","66.99","44.29","LST","1103471"
"6233001","ACANA CT RGNL GRASSLANDS 9.9LB","ACANA","0","1","66.99","44.3","LST","1103474"
"6233002","ACANA CT RGNL PACIFICA 9.9LB","ACANA","0","1","66.99","44.3","LST","1103468"
"6233003","ACANA CT FRST FST KIT 4LB","ACANA","0","1","29.99","19.54","LST",""
"6233004","ACANA CT HMSTD HRVST 4LB","ACANA","1","1","29.99","19.54","LST",""
"6233005","ACANA CT HMSTD HRVST 9.9LB","ACANA","3","1","55.99","37.59","LST",""
"6233006","ACANA CT INDR ENTRE 4LB","ACANA","4","1","29.99","19.54","LST",""
"6233007","ACANA CT INDR ENTRE 9.9LB","ACANA","0","1","55.99","37.59","LST",""
"6233008","ACANA CT BNTFL CTCH 4LB","ACANA","2","1","29.99","19.54","LST",""
"6233009","ACANA CT BNTFL CTCH 9.9LB","ACANA","0","1","55.99","37.59","LST",""
"6233013","ORIJEN DG SMBRD 4LB","ORIJEN","0","1","35.99","23.45","LST",""
"6233014","ORIJEN DG SMBRD 10LB","ORIJEN","2","1","70.99","47.65","LST",""
"6233652","MX&ML DG SMRTID CLR DONUT 1LG","MAX & MOLLY URBAN PETS","1","1","31.99","15.65","LST",""
"6233659","MX&ML DG SMRTID CLR DONUT 1MD","MAX & MOLLY URBAN PETS","1","1","27.99","14.03","LST",""
"6233855","MX&ML DG SMRTID CLR DONUT 1XS","MAX & MOLLY URBAN PETS","1","1","20.99","10.45","LST",""
"6233936","B&B PLUSH MAT GRY 48X30","BAILEY & BELLA","1","1","84.99","48.6","LST",""
"6234059","PETSF PET FTAN 3.7L","PETSAFE","0","1","79.99","45","LST",""
"6234144","PERF ULT HD-F CH RLL 4IN MD","PERFORMATRIN ULTRA","30","30","8.29","3.55","LST",""
"6234145","PERF ULT HD-F CH RLL 7IN LG","PERFORMATRIN ULTRA","21","21","13.99","6.6667","LST",""
"6234149","PERF ULT HD-F CH STK5IN3.5OZ","PERFORMATRIN ULTRA","5","1","14.99","6.34","LST",""
"6234425","PP CT SWAN FTAN 1EA","PIONEER PET","0","1","72.99","40.12","LST",""
"6234449","TL OCTOPUS DG TOY 1SM","TUFF LOVE","0","1","12.99","6.24","LST",""
"6234450","TL OCTOPUS DG TOY 1MD","TUFF LOVE","0","1","19.99","9.87","LST",""
"6234451","TL OCTOPUS DG TOY 1LG","TUFF LOVE","0","1","25.99","12.99","LST",""
"6234452","TL WHALE DG TOY 1SM","TUFF LOVE","0","1","9.99","4.8","LST",""
"6234453","TL WHALE DG TOY 1MD","TUFF LOVE","1","1","12.99","6.5","LST",""
"6234454","TL WHALE DG TOY 1LG","TUFF LOVE","0","1","19.99","10","LST",""
"6234456","TL LION DG TOY 1MD","TUFF LOVE","0","1","19.99","10","LST",""
"6234457","TL LION DG TOY 1LG","TUFF LOVE","0","1","25.99","13","LST",""
"6234614","MX&ML DG SMRTID CLR DONUT 1SM","MAX & MOLLY URBAN PETS","1","1","24.99","12.47","LST",""
"6234620","LW SB SND PRCH CVR 6PK","LIVING WORLD","0","1","4.99","2.5","LST",""
"6234621","LW CKTL SND PRCH CVR 3PK","LIVING WORLD","0","1","5.99","3","LST",""
"6234623","HARI BRD OYSTER SHL 15OZ","HARI","0","1","7.99","3.4","LST",""
"6234670","JAYS TA DG CHICKEN MEATBARS1oz","JAY'S","12","12","3.49","1.6108","LST",""
"6234855","ESN PPBG DSP BLK UNSC 1EA","ESSENTIALS","3","1","4.99","2.29","LST",""
"6234860","CRMP DG MINI TRAIN FD BF4.4oz","CRUMPS' NATURALS","1","1","17.49","9.25","LST",""
"6234861","CRMP DG MINI TRAIN BF10.6oz","CRUMPS' NATURALS","0","1","17.49","9.25","LST",""
"6234862","CRMP DG MINI TRAIN CK 10.6oz","CRUMPS' NATURALS","1","1","17.49","9.25","LST",""
"6234863","ZIGNATURE DG KANGARO ZIGGY12OZ","ZIGNATURE","0","1","15.99","6.44","LST",""
"6234864","ZIGNATURE DG LAMB ZIGGY 12OZ","ZIGNATURE","0","1","15.99","6.44","LST",""
"6234865","ZIGNATURE DG TKY ZIGGY 12OZ","ZIGNATURE","0","1","15.99","6.44","LST",""
"6234866","ZIGNATURE DG SLMN ZIGGY 12OZ","ZIGNATURE","0","1","15.99","6.44","LST",""
"6234867","SD CT AD CK CSSRL 2.8OZ PCH","HILL'S SCIENCE DIET","0","24","3.49","2.1883","OOS",""
"6234868","SC CT AD 7+ TUNA DNR 2.8OZ PCH","HILL'S SCIENCE DIET","24","24","3.49","2.1883","LST",""
"6234869","SD DG AD SB SENS STMCH 30LB","HILL'S SCIENCE DIET","1","1","125.99","95.22","LST",""
"6234875","SD DG SEN ST&SK CK&VG 12.8OZ","HILL'S SCIENCE DIET","12","12","5.79","3.6975","LST",""
"6234883","NB DG LID SL&BR 4LB","NATURAL BALANCE","0","1","31.99","17.92","LST",""
"6234884","NB DG LID DCK&BR 4LB","NATURAL BALANCE","0","1","32.99","20.69","LST",""
"6234901","T&T DG SYDNEYS STOGIES 3PC","THIS & THAT","0","1","15.99","7.5","LST",""
"6234903","T&T DG SYDNEYS SM PLANKS 1EA","THIS & THAT","0","1","11.99","5.65","LST",""
"6234904","T&T DG SYDNEYS LG PLANKS 1EA","THIS & THAT","0","1","11.99","5.65","LST",""
"6234905","T&T DG SYDNEYS WOLFFISH 1EA","THIS & THAT","0","1","18.99","9.71","LST",""
"6234911","T&T DG ENHA ANT MPL BCN SM 1EA","THIS & THAT","1","1","18.99","10.08","LST",""
"6234912","T&T DG ENHA ANT MPL BCN MD 1EA","THIS & THAT","0","1","26.99","14.23","LST",""
"6234913","T&T DG ENHA ANT MPL BCN LG 1EA","THIS & THAT","1","1","37.99","20.19","LST",""
"6234915","T&T DG ENHA ANT BEEF LVR SM1EA","THIS & THAT","0","1","18.99","10.08","LST",""
"6234916","T&T DG ENHA ANT BEEF LVR MD1EA","THIS & THAT","0","1","26.99","14.23","LST",""
"6234917","T&T DG ENHA ANT BEEF LVR LG1EA","THIS & THAT","0","1","35.99","19.1","LST",""
"6234925","RCSHN DG PUP GIANT 30LB","ROYAL CANIN","0","1","126.99","82.2","LST",""
"6234931","PETSF DG EZ WALK HRN 1M/L","PETSAFE","0","1","34.99","16.32","LST",""
"6234984","PPLN CT LIVECLEAR CHK&R 3.5LB","PURINA PRO PLAN","1","1","36.99","27.84","LST",""
"6235000","PPLN CT LIVECLEAR CHK RICE 7LB","PURINA PRO PLAN","2","1","64.99","47.72","LST",""
"6235001","PPLN DG SPT CK&R 30/20 37.5LB","PURINA PRO PLAN","0","1","109.99","83.24","LST",""
"6235002","PPLN DG SPEC SS&S LMB&OM 16LB","PURINA PRO PLAN","0","1","74.99","59.78","LST",""
"6235003","PPLN DG SS&S PUP 16LB","PURINA PRO PLAN","1","1","74.99","59.78","LST",""
"6235035","SC DG RW BLND WG CG FREE 3.5LB","STELLA & CHEWY'S","0","1","43.99","27.7","ROS",""
"6235037","SC DG RW BLND WG REDMEAT 3.5LB","STELLA & CHEWY'S","0","1","44.99","28.37","LST",""
"6235038","SC DG RW BLND WG REDMEAT 22LB","STELLA & CHEWY'S","0","1","159.99","103.37","LST",""
"6235060","RB DG BULLY RING SM 1EA","REDBARN","0","35","17.99","10.1246","LST",""
"6235061","RB DG BULLY STICKS 24IN","REDBARN","0","25","31.99","18.0488","LST",""
"6235063","RB DG PUFF BRAID ESOPGS LG 1EA","REDBARN","0","10","12.49","6.484","LST",""
"6235082","RB DG NT FLD BN CK&BC SM3.5OZ","REDBARN","0","20","8.69","4.7635","LST",""
"6235083","RB DG NT FLD BN PB SM3.5OZ","REDBARN","20","20","8.69","4.7635","LST",""
"6235084","RB DG NT FLD BN CK&AP LG8OZ","REDBARN","15","15","14.99","7.7173","LST",""
"6235085","RB DG NT FLD BN CK&BC LG8OZ","REDBARN","15","15","14.99","7.7173","LST",""
"6235086","RB DG NT FLD BN PB LG8OZ","REDBARN","15","15","14.99","7.7173","LST",""
"6235094","BB BURSTS FLD CAT TRTS CHKN2OZ","BLUE BUFFALO","0","6","3.39","1.5683","LST",""
"6235095","BB BURSTS FLD CAT TTS SEAFD2OZ","BLUE BUFFALO","0","6","3.39","1.5683","LST",""
"6235096","BB BURSTS FLD CAT TRTS CHKN5OZ","BLUE BUFFALO","0","6","5.99","3.23","LST",""
"6235097","BB BURSTS FLD CAT TTS SEAFD5OZ","BLUE BUFFALO","0","6","5.99","3.165","LST",""
"6235115","BB BON EMB RND BED TPE 38IN","BAILEY & BELLA","0","1","62.99","31.5","ROS",""
"6235236","JMP DG TRN LD 20FT","JUMP","0","1","20.99","9.45","LST",""
"6235237","JMP DG TRN LD 30FT","JUMP","2","1","24.99","14","LST",""
"6235238","JMP DG TRN LD 50FT","JUMP","0","1","34.99","15.75","LST",""
"6235348","PP CT SWAN FLTR 3PK","PIONEER PET","0","1","16.99","9.34","LST",""
"6235488","BWSR SHG DOT BED WHT 36X30 1EA","BOWSERS","0","1","139.99","76.99","LST",""
"6235489","BWSR SHG DOT BED WHT 43X34 1EA","BOWSERS","1","1","184.99","110.99","LST",""
"6235490","BWSR SHG DOT BED WHT 50X38 1EA","BOWSERS","0","1","219.99","131.99","LST",""
"6235491","BWSR LOUNGER CHAR 35X28 1EA","BOWSERS","0","1","139.99","76.99","LST",""
"6235492","BWSR LOUNGER CHAR 39X30 1EA","BOWSERS","1","1","184.99","110.99","LST",""
"6235493","BWSR LOUNGER CHAR 47X35 1EA","BOWSERS","1","1","219.99","131.99","LST",""
"6235840","JMP DG CLR PNAPPL BLU 1LG","JUMP","0","1","17.99","7.05","ROS",""
"6235879","JMP DG CLR DOT GREY 1MD","JUMP","0","1","16.99","6.62","ROS",""
"6235880","JMP DG CLR DOT GREY 1LG","JUMP","0","1","17.99","7.05","ROS",""
"6236000","S&C DG CB BITES BCN&PORK8.25OZ","STELLA & CHEWY'S","2","1","14.99","8.57","LST",""
"6236045","HERM DG PRNG CLR 14IN","HERM SPRENGER","0","1","36.99","21.57","LST",""
"6236046","HERM DG PRNG CLR 18IN","HERM SPRENGER","0","1","45.99","25.98","LST",""
"6236047","HERM DG PRNG CLR 20IN","HERM SPRENGER","0","1","48.99","30","LST",""
"6236048","HERM DG PRNG CLR 22IN","HERM SPRENGER","0","1","58.99","36.72","LST",""
"6236049","HERM DG QK RLSE PRNG CLR 14IN","HERM SPRENGER","0","1","46.99","28.72","LST",""
"6236050","HERM DG QK RLSE PRNG CLR 18IN","HERM SPRENGER","0","1","56.99","32.84","LST",""
"6236051","HERM DG QK RLSE PRNG CLR 20IN","HERM SPRENGER","0","1","62.99","34.61","LST",""
"6236053","HERM DG PRNG LINKS 2.25MM 3PK","HERM SPRENGER","0","1","12.99","6.92","LST",""
"6236054","HERM DG PRNG LINKS 3MM 3PK","HERM SPRENGER","0","1","16.99","9.19","LST",""
"6236055","HERM DG PRNG LINKS 3.25MM 3PK","HERM SPRENGER","0","1","17.99","9.82","LST",""
"6236056","HERM DG PRNG LINKS 3.80MM 3PK","HERM SPRENGER","0","1","22.99","12.72","LST",""
